User,Comment
Sagor Afridi,ভিডিও টা অনেক সুন্দর লাগলো লাভ ইউ প্রিয়🇧🇩
আধুনিক কবিরাজ,উনাদের প্রতি মানুষের আস্থা আছে.... ।
kaniz mumu,গতকাল ভোক্তা অধিকারীর অভিযানের ফাঁকে রাফসানকে একবার দেখা গিয়েছিল। এই পুঁচকে ছেলেটাকে যে কি ভালো লাগে !বেস্ট অফ লাক ️
HS Hridoy Sheikh,Last lines guli
Md Easin,শেষের কথা গুলো ভাই একদম ঠিক ছিলো
MxN Organic Product,মিথ্যা হতে দূরে থাক কেননা মিথ্যা চেহারাকে কালো করে দেয়। __(হযরত মুহাম্মদ (সা:))
Mr Madaripurltd,শেষের কথা গুলো অনেক মূল্যবান  কথা
Md Tarikul Islam,0:46 sultan's dine took my brother
jubayer ahmed,ভাই এত বছর ধরে ওদের খবার কত মানুষ খেলো কখনো কেও কিছু বুঝল না যে ওইটা কিসের কাচ্চি কিন্ত হটাত মানুষ কি এমন জিনিয়াস হয়ে গেল যে খাশি আর কুত্তার মাংস আলাদা করতে পারছে
__Cr@zy_boy__,হাসতে হাসতে শেষ
Shbdo Premik,নামাজ বাদ দিওনা বন্ধু এপারের চেয়ে ওপারের জীবন বেশি সুন্দর
মোহাম্মদ মানিক,খুব হাসলাম ব্রো।
Aŕt & Cŕafț,বিয়ার গেইলস হওয়ার সপ্ন পূরণ হয়ে গেল
Shaikh Khaled,যারা কুত্তার বিরানী করছে।তাদের ফাসি হওয়া উচিৎ।Rafsan the choto bhai bring justice for this people.
Shalam Mula,Alla is great ️
Imam Hasan Tushar,সত্যি লাস্ট কিছু কথা মনে গেথে গেল
MO Things,"রাফসান এর লাস্ট কথা সত্যিই সত্যি ছিলো এই জন্যই রাফসান এর ভিডিওগুলো আমি লক্ষ করি
good luck and love you choto"
Tahsin Babar,"The way he is saying ""kuttar mangsho""."
Nazrul Islam,শেষের কথাগুলো দারুণ লাগলো।
☕BARISTA REZA☕,Just salute bro 🫡🫡
HOPE EDITOR202,"Why you're eating ""kuttas mangsho""️"
𝖬𝖣.𝖱𝖾𝗆𝗈𝗇,𝖳𝗁𝖺𝗇𝗄𝗒𝗈𝗎 𝖻𝗋𝗈 শেষ এর কথাটা শুনে খুব ভাল লাগছে
Emon Das,Sera vai love it
محراب,1:14 dorime ameno ameno latire
Ashiq Ahsan,আমার কথা হলো কনজিউমার এসোসিয়েশনের নির্দেশনা অনুযায়ী প্রত্যেক রেস্টুরেন্টের কিচেন ওপেন গ্লাস দেওয়া থাকবে। যাতে কাস্টমার কিচেনের পরিবেশ ও খাবার তৈরীর পক্রিয়াটা সচোখে দেখতে পারে। তাহলে সুলতান যদি সৎ ব্যবসায়ী করে। তাহলে এতো অভিযোগ ও অভিযানের পরও কেন কিচেন ওপেন করেনা।
Ruhiya Hoq,1:18 best
Sayra Mayeen Chowdhury,কিভাবে জানা যায় যে কাচিটা কুকুরের নাকি খাসির???  আমার সবচেয়ে পছন্দের রেস্টুরেন্ট!
Bless Aqua Garden,ইন্ট্রোটা সেই
Rahu Vlogs,Last er line gula onk vloh lagche vaiya
Rony,"The way he was saying  ""kuttar mangsho"""
Siddi Saha,"ভাই আপনি একটা ইয়ে,  আপনি একটা ভাল ইয়ে, আপনার ইয়ে আছে। The most funniest part."
asad Ahmed,Funny vlog
M80 Motivational Waz,Love From M80 CarToon ️
SM,"ভালো লাগলো, সেরা ভিডিও"
Yr Minions,শেষ দেড় মিনিট ️
Jafrin Jerin,Rafsan bhai  just wow
Airport Vlog,"বাহ চমৎকার  এগিয়ে যান ভাই।।
এসব কাচ্চি বিরিয়ানি আপনাদের জন্যই"
rubel md,Thank you  bro
Shahed Ahmed,:এটা আল্লাহর সৃষ্টি এদের নিয়ে বিরিয়ানি বানানো উচিত না
Farzana Akter,"Vaiya toma k salam janai 🫡
Tomar kotha gulo akdom sotto ️"
Mohammad Khalilur Rahman,This agm is amaiging.
brianna,4:14 I CANT BREAFSFSF HAHAHAHAHA
MD Tashin,সেরা
shariar alvi,"Mama, come to Banani.. money can buy you happiness ️ Proti raat e porir mela bosay..pori niye khela kori"
rexo,8:20  vai eta ki chilo
Pranto Khan,Last er kotha gula best chilo
Shilpa Kar,Khub sundor chilo sas ar kotha gulo ️
Faizah Lubaba Shristy,Rafsan please put eng captions
Hasin Marjan,"Even if the biryani is not made from the dogs still most of the food items price in the   restaurant of  our country are overpriced,cooked food with unhealthy oil ,the kitchen are not clean enough,food are not freshly served.Although even a plate of french fries cost 100/150 taka . This corruption required to be stop."
TaniJoonie,The last lines
Fabiha Ashrafi Esha,
Rabeya Khatun,Asholei joruri na j j opobad e deya hok kono protisthan k seta sotti e hobe Tai etotaw hashi moja na niye tader sathe organisely ekta investigation kora Rafsan bro you are awesome and your content is always Uniq May Allah bless you ameen
Shahid Rumi,️....
Farhat Lamisa,Rafsan bhai showed the offensive memes...
SWAT SAKIB,"ন্যায় নীতি নৈতিকতা শুধু মাত্র ইসলামেই রয়েছে, আমার সবার কাছে ইসলামের দাওয়াত পৌছে দিতে হবে। আল্লাহর ভয় এবং আল্লাহর রহমত সম্পর্কে সবাইকে সচেতন করতে হবে। এছাড়া আপনি সবাই ভালো পথে আনতে পারবেন নাহ।"
Md Forhad,Well said hope you will come to Al jazz restaurant in chittagong
TRZxAssassiN,ইমেজ ঠিক করতে এখন কন্টেন্ট ক্রিয়েটর দের ডাকা হবে
Shirsho Das,রাস্তার ভাইয়া টার মন অনেক  কোমল
Kathgolap Record And Films,রাফসানের মুখ থেকে কু-T-TA শুনতে সেই ভাল্লাগছে... কি কিউত!!!
Tahamidul Islam,You are nice man
Tanvir Ahmed,Whatever it is people should handle this with respect and should not disrespect someone without any hard evidence.
Mr. Jabir,"এই টা যদি কুত্তার বিরিয়ানি হয়ে যায় তাহলে আমার খুব কষ্ট লাগবে 
কারণ dogs are really cute man"
𝐉𝐚𝐫𝐢𝐧 𝐑𝐚𝐟𝐚 ♥︎,first vaiya take
Graphic Designer,"আজকে সুলতান'স ডাইন আগামীতে ঢাকা শহরের বুফ‍্যে রেস্টুরেন্টের মধ‍্য থেকে একটির ভাইরাল হবে এভাবে; আসলে ব‍্যবসা প্রতিষ্ঠান হচ্ছে যুদ্ধ ক্ষেত্রে যুদ্ধ করার মানসিকতা, প্রতিযোগিতা ভাবনা সম্পন্ন একটি scenario মাত্র।"
OnceBliss,It is critical for food reviewers to be sensitive and responsible in reviewing a matters related to health and safety. Making fun of sensitive issues can downplay the potential threats that businesses and customers might face. You failed to keep professionalism in my assessment. Please make another sensible video that may help us to solve the puzzle. Best wishes!!
bangla,Yes brother
Shehab Alvi,I don't know what's going on i mean the meat is  or  but  Sultan's dine behavior was so rude in zigatola . So happy to see their  degradation.
Mosabbir Talukder,Fantastic Brother
Xiam Ahmed,2 MINIT 2 K VieW
Naimulmusfiq Naim,"I learnt one thing sadly in previous few years- ""In business, trust no one."" I mean, you can never trust someone doing business with you except clear and transparent evidence."
Bd Twist Ff,intro️‍
Azad Khan,Thank you Rafsan vai
Islamic Center,আমি আয়েশা পবিত্র কুরআনের হাফেজা হয়েছি সবাই দোয়া করবেন ️
Gojo X Satoru,Best intro ever
Your ROBI,Rafsan the investigator
Prottoy Hasan,বিড়াল
CrL Gameing,thanks bro️
Md. Asadur Rahman,How could a human call a dog his brother?
Halima Akter,"Rafsan The Choto Vai manei 
Fire️‍️‍"
Kawchar Mahmud Films,ইনশাআল্লাহ ভাই সাপোর্ট পেলে আমিও আপনার মতো ভিডিও তৈরি করবো
বিনোদনযোগ-Binodonjog,"ল্যাব রিপোর্ট দ্রুত আসুক, সম্মান বজায় থাকুক সুলতান ডাইনের ।"
Monim ahmed,10:10 Sad but reality
A,The way you say kutta . Jossss brooo
SHARIFUL ISLAM,"ভাই,  আপনার সাহস আছে। আপনার ফেন হয়ে গেলাম"
Alifboss,Love u vhai
mizanur Rahman,8:35
Abir Dey,"সুলতান ডাইনস যদি আমাকে একবার ফ্রি তে বিরিয়ানি  খাওয়ায়,  অবশ্যই একটা ভালো feedback দেবো,,  জানিনা কয়জন সেটা নেবে"
🖤Savage girl🖤,I love my Bangladesh very much. But when I hear them it feels very bad.
Sa Nto,I like it vaia
Zawad special,আসসালামু আলাইকুম সবাইকে...! আলহামদুলিল্লাহ...! ️ আপনাদের ভালোবাসাই  ২০০+ পরিবার সফল হয়েছে। ️️আশা করি আপনারাও পাশে থাকবেন।
Iamim Isra Munni,Right bro
Khadiza Monowar,I just like your mentality
Tamzid Ahmed,"Rafsan vai jiboner onk boro risk nise ... 
Salute Rafsan vai ..."
Rahman Rahim Md,"আমাদের সবার অনেক কিছু বোঝার ও জানার আছে, কেনোনা পরিমিত শিক্ষা বোধ সম্পন্ন মানুষগুলো সমাজের জন্য ক্যান্সার।"
Siam 742,"Rafsan Vai,,. 
Nice Marketing,,."
Abdullha bin lam,লাস্ট লাইনগুলো দেশের কথা বলে
AS IB,শুরুতেই যে ছেলেটার সাথে কথা কইলেন।।He is still in pinic
Jishan Vai,ভাই ভিডিও মজা হইছে
Shahriar Mamun,Sultan's Dine trying hard to get back on track. Probably a month's free kachchi for Rafsan for this promotion.
HASAN KHAN 007,ভাই আপনার শেষের কথাটা বুকে এসে লেগেছে ভাই
Sharif Ahmmed Shimul,How funny it was...
Jannatul Urmi,
Zuhan Misbahul Hossain,so true i saw 3 dogs outside sultan dine then when it opened there was only 1 dog
Km Pappu,"সব সময় আপনার ব্লগ দেখি, কিন্তু আজকের ব্লগটা একতরফা হয়েছে, ৫কেজি মাটন কি খাওয়ার  উপযুক্ত,আপনি কি মনে করেন?"
Rifat khan,"Call Chef Gordon Ramsay kitchen Nightmare.....
Shocking Service
But Sultan Dine is Best"
ZAHID SAKIB,Right now Dog's Dine
ADIB ★♥,Best video hoise bro ️️‍
zahidul alam,last few words 100 % right...for this like it
poggyi,Rafsan can I get a heart? ️
Ibrahim,Brooo 1:14 I am wheezing.
JA01N7R,Well said
Rinku Deb,Just love u️
DAIYAN KHAN & MANHA KHAN,ভাইয়া এক পিস ওনাকে খেতে বলতেন তাহলেই তো হতো
Anee Ali,"""পূর্ণজন্ম"" নাটকের কথা মনে পড়ে গেলো.... যেখানে নায়ক আফরান নিশো ওর restaurant এ মানুষের মাংস কেটে রান্না করে খাওয়ায় আর সুলতান ডাইন এ কুত্তার মাংস.... it’s digital Bangladesh"
FF RANA YT,"Apnar video gula onk valo lage 
Love you bhai"
Sakib Sarker,Best off luck bhai
Nobab Rahat Ahmed,Bring justice
OUTSHINE TECH,"Even if you don't watch the whole video, please at least watch the video from 9:56"
Sourov 03,"Bhai.....jast oshadharon chilo ...
Ajonnoi... apnake eto eto bhalo lage"
Ileas Khan,বাংলাদেশে কাহিনীর শেষ নেই। তদন্ত করে ব্যবস্থা নেওয়া হোক। কে সত্য?
Juwel Miya,The dogs want Justice
Deepok Roy,1.01 Best part
Khandokar Rakib Hossain,Valo lagse bro️
Rahat Khan,Love u Bro
selinaselina aktar,Find the right way if you have time ️
F A L L E N,Detective Choto Bhai!
Mr &  Mrs Amin easy recipe,Awesome vedio vaia
Adhora Islam,আপনার শেষের কথা গুলো সত্যি।
ফসল,আসসালামুয়ালাইকুম ভাই ।বাংলাদেশ যে পরিমান কাচ্চি বিক্রি করা হচ্ছে। এত খাসী কোথায়  থেকে পাচ্ছে আমাদের দেশে খাসী মাংস ১১০০টাকা প্রতি কেজি হইলে২০০  গ্রাম দাম পরে২৪০টাকা।আমার মনে হচ্ছে মিক্সড করা হচ্ছে। এই ব্যাপারে সরকারি ভাবে তদন্ত করা উচিত।
Abdul Kader,শেষের কথা গুলো খুব ভালো লাগছে।
Udhoy Ahmed Sojib,Rafsan you are rock
Tayaseer Aswad Hussain,আমি জীবনেও সুলতান ডাইনসের টা খাব না কান ধরসি
rocking rock,"I don't know why but
it seems Rafsan is paid for this video by sultan's dine🫢"
David Benjamin Singha,শুকরের বিরিয়ানি বলতে গিয়ে ছিল।
incomingaudiogamer,"Aitaaaa.....Allahr sriSti! Aita die biriani banano Uchit na....  :,)"
Kazi Niamul,"ভাই রেস্টুরেন্টে গোস্ত জাতীয় খাবার  খাওয়া বাদ দিয়ে দিছি অনেক আগে,ভাল্লাগে না মনের মধ্যে এত্ত ভয় নিয়ে খাওয়া"
Roman Alam haque,Hello Rafsan brother my name is Roman and I live in London and I watch your videos and I also watched with the actor Sohel khan and today I just watched at the sultan dine restaurant and they make dog biryani those are true what the average says and when i heard this it disgusted me and i believe that in bangladesh everything is possible because of this country people do not think about what they are feeding the people because this country has money and can do everything that is why this country is so poor and he does not have equal rights and this country the politicians are bigger corrupt and the policemen of bangladesh are bigger mafias and this country everything is possible and i am guilty is the government of bangladesh and the one who do as sultan dine they make dog biryani that Put him in prison forever and do not do it again to other people and when they see this they will be afraid and I think that first the laws of Bangladesh have to be tougher then the people of Bangladesh will be afraid to do things like that
Mohammed Al,5:42 ki jeno bole felte gesilo Rafsan
Ahmed Hassan,Excellent. Thanks
Ms serin Akther,ঠিক বলছেন ভাই
Sayam Sk,ভায়া ওদের কে খেতে বলেন
ShaKib Play’s,সেরা
Rehan Al been,রাফসান ভাই ছোট্ট একটা প্রশ্ন আপনাকে তো হাড্ডি করা পিছ  দিলো  না
Md Riaz,ভাই টাকার কাছে সবাই বিক্রি
Sadia afrin,His talking and licking his fingers
Tanvir Ahmed,Right broo..এটাই বাংলাদেশ
ubaydur rahman,Love you Rafsan bhai
Iftekhar Ahmed,"ছোট ভাই  যদি কোরবানি তে নিজ হাতে ছাগল টুকরা করতা, তাইলে বলতা না ছাগলের হাড্ডি চিকন কেন"
Freelancer ariyanahmed,Rafsan is a ️️
md. sami,Onk funny shilo vai
Reduan Prottoy,আপনার শেষের কথাগুলো ভালো লাগলো।
Emran Hossain,at last words amazing bro
Moin,আপনি তদন্ত করবার কে                  এই টা হচ্ছে প্রশাসনের দায়িত্ব  ️
Vita Health Care,এরকম একটা ইস্যুর পর পর ঐসব রেস্টুরেন্টে যাওয়া উচিত। এতে আলগা খাতির যত্ন আর আসল মাংস পাওয়ার সম্ভাবনা শতভাগ।
ASHRAFUL MUNNA,10:1 Best ️
Saif Khan,"সবসময় মালিক পক্ষ কে খারাপ মনে করার কোনো মানে হয় না ,  কাস্টমাররাও খারাপ হয় ,  গত বছর এইভাবে একজন বিরিয়ানি বিক্রেতা কে ফাসানো হয়েছিলো"
DAIYAN KHAN & MANHA KHAN,ভাইয়া আপনি যেখান থেকে মাংসটা উঠিয়েএক পিস খেলেন ওইখান থেকে ওনাকেও  খেতে বলতেন এক পিস বলতে আসেন আমরা এক পিস শেয়ার করে দুজনে খাই কুকুরের মাংস হলে তো তিনি আর খেতেন না ভাইয়া তখনই তো প্রমাণ হয়ে যেত বলেন
YouTube Paglami,Sesh er kotha gulo valo lagse bro
Kabya Hassan,Harsh reality....last lines
TANVIR,Big Sponsor
TANVIR,Big Sponsor
TANVIR,Big Sponsor
স্বাক্ষর,"কিছুই বুঝিনা ভাই!  মানে আমি এখন ইচ্ছা হইল যে কোনো যায়গা থেকে একটা খাবার আনলাম দামি রেস্টুরেন্ট থেকে এর মধ্যে উল্টাপাল্টা ফালায় দিয়ে ভিডিও করা শুরু করলাম আর তাতে তাদের কোটি টাকার বিজনেস শেষ হয়ে গেলো?? কি সুন্দর না?  
খালি খালি শিক্ষার হার এত কম না বংলাদেশে"
Amir Hamza,Nothing to say
Nobabini Moni Lifestyle,Asolei moja pailam...savar e coming sultans dine
Mohammad Nayeem,শেষের কথাগুলো অনেক ভাল্লাগসে ভাই
Ali Akbar Tuhin,Food blogger der ekn income hobe Sultan dines theke.... Money talkes
Kawchar Mahmud Films,অনেক ভালো লাগলো ভাই
Afsara,Seriously Rafsan
Shuvo Turjo,
Saiful Islam,ভাই ওদেরকে একটু খেয়ে দেখাতে বলতেন আপনার সামনে।
preetam dhar,"ভাই আমিও পাইসিলাম চিকন হাড্ডির সাদা মাংসের পিস কাচ্চিতে। আগ্রাবাদ ,চট্টগ্রাম শাখা থেকে আনা  হইসিলো"
Sahed Alam Vlog,Just wow vhiya
Bidyut Hansda,এটা একমাত্র বাংলাদেশ এই সম্ভব।
Muhammad Nayeem,এটা আপনার সেরা ভিডিও ছিলো।
Preenon Digital,সুলতানস ডাইন যেটাই করুক না কেন....এই কয়েকদিন সুলতানস ডাইনের খাবার খাবেন কারন ওরা এই মুহুর্তে  ভুলেও খারাপ কিছু খাওয়াবে না
Mahbub Bhuiyan,Right
Reduan Islam Anik,Bhai prothom dikee shei moja paisi
Ahanaf Ahmed Ayan,Bring in gustis for as I like our vlogs very much
Md. Saiful Haque,
MD Sarowar Islam Munna,ভেজাল মামা ভেজাল
Imtiaz Ahmed,"Background  e 'who let the dogs  out"" song ta dile joss hoito...."
SM CG,"Sultan's dine এর রেপুটেশন খারাপ করতেই এই উদ্যোগ। 
যাই হোক সামনের সপ্তাহে যাচ্ছি বাঘের বিরিয়ানি খাইতে"
Muhammad Rasel,️️️
Marzan akhatar,Thik kotha blso vai
Rishad Was bee,I'm not emotional are you
Tarak Karmaker,"If you wish to change the situation positively,"
My Day,ভাই কুতার কাঁচি কেমন লাগলো
TB TAMIM,Daud Kim hairstyle
soniya rahmaan,last er kotha ta akdom right
sal sabil,Aww your hair ..man! You look damn hot today
Maysha Jahan,Last one
Md Saeidul Islam,Thanks rafsan
MhdR media,
Prima peer group,ভাইয়া DNA TEST করান তাহলে প্রমাণ হয়ে যাবে কুকুর নাকি খাসি
Moon Biswas,Last er kotha gula shei chilo vai️
Rakibul Hasan,Their only told ey... Ey..
Farjana sweety,রাফসান হকের রান্নার কথা মনে পড়ে গেল
Abir Ahamed,"last er 35 second er kotha gula joss lagce bhai 
Take love"
Payal life Style,0:25  0:38
The Food Capture,
GTA GAMER,
Ifat Khan,Rafsan vi....I want to meet u....
Md. Abul monsur,
Tishia Tasnim,আমাদের বাসার সামনের কুত্তা টা খুজে পাওয়া যাচ্ছে না
Shahanaz parvin sathi,যাহা রটে তার কিছু হইলেও ঘটে
রক্ত চুষা,ভালো লাগলো অনেক
Ashikur Rahman NaziL,শেষ কথাগুলো সুন্দর ।
Mirza Ahanaf,8.42
Mominor Islam Mahady,"বাংলাদেশে কি কি জানি হয় টাকা থাকলে ভিডিওর শেষে বললা কথা গুলো ভালো লাগলো, কথা গুলোর জন্য সাবস্ক্রাইব করাই যায়,সাবস্ক্রাইব করে দিলাম ️"
Nahil Hasan,Allar sristi
Farzana Jhorna,
Ms Diba,"আসলে আমি নিজেও জানি না তারা কিসের মাংস বিক্রি করেছে , তবে এইটা বলতে পারি অনেক কাচ্চি খেয়েছি যার মধ্যে চিকন হাড্ডি নরম মাংস এর পিস ও পেয়েছি । 4,5 মাসের খাসি ও জবাই করা হয় আর সেইটার ও হাড্ডি চিকন থাকে ।"
DAIYAN KHAN & MANHA KHAN,ভাইয়া আমি যে প্রশ্নটা আপনাকে করলাম আশা করি সেটার উত্তর আমাকে আপনি দিবেন
Observer,"Only For the last message, i liked this video."
Amal Das,0:46 was
Suman,ভাই এত কুকুর কোথা পাবে ৷
Gadgetoo,
Jannatul Ambia Dristy,️
md ahsan,
sr sabbir,vaiyar sesh kotha gula onk valo lagche
Mizan Rahman,️
Mahabubur Rahman,️
Siyam Ahmed Labib,Ses kotha gula valo lagse vai 🫶
Tanjima Hossain,যারা এই কুত্তার বিরানি বলছে তাদের ব্যাপারে তদন্ত করা দরকার যে ওরা কী সত্যিই করছে না উদ্দেশ্যমূলক করছে এটার একটা প্রমান সহ ব্যাখ্যা দরকার
Ms Farjana,তাদেরকেও একটু করে খাইয়ে  দেখানো হলে ভালো হতো।
Najah Fineline,
Ahemad Bro,
Reefat Alam,"That's really bad 
We want justice rasfan bro"
Fast and Furious,Sultan dain this is the best
CelelXeditz,0:34 Ronaldo photo on the background.
Md Tarikul Islam,Ore content re vai
Alf H Radi,Tnx for the video
Beautybithi,রাফসান ভাইয়া তোমার লাস্ট কথা গুলা ঠিক ছিলো
Maliha Tabassum,Bhai
Faiza,7:50 te dhora khacche
GamerBoy NadimFF,Vai apni ato funny kn
ay,"""eita Allah-r shirshti"""
md Shafiqul Islam Akash,Right bro
Sumaiya Sumu,Futfute sunod biriyani
