User,Comment
ferdous akon,"কোন মিথ্যা অভিযোগে যেন কারো ব্যাবসা শেষ হয়ে না যায়। 
সেটা খুব সতর্কতার সাথে দেখা ও চ্যনেলগুলোকে সতর্কতার সাথে প্রচার করার অনুরোধ করছি। 
কোন প্রতিষ্ঠিত প্রতিষ্ঠান তার ব্রান্ড ভেলু কমাবার ঝুঁকি কেন নিবে।
খাবারের ফরেনসিক ল্যাব টেষ্ট করা উচিতছিলো অভিযোগ পাওয়ার পরই।"
Md babu,Manager 1video te bollo 2kg/2.5 kg khasi
MD: Anik Ahammed,
Graphic Designer,"ব‍্যক্তিগতভাবে ঘরের বানানো কাচ্চি সবচেয়ে ভালো হবে, মহিলা উদ‍্যোক্তা আপুদের কাচ্চি নিয়ে বড় লেভেলের উদ‍্যোগ গ্রহণ করা উচিত"
Md Kowsar Ahmed Md Kowsar Ahmed,ভাইয়া ইংরেজি  একটু কম করে বলবেন কারণ অনেক বয়স কতো লোক আপনার ভিডিও দেখে তারা ইংরেজি ভাষা বুঝতে সমস্যা হয়
NH,Absolutely right rafsan bro bangladeshi taka chara ar kichu boje na
Sarwat plays,Ami aitai bujlam na mohila ta ki biral er mangsho khaise? Like biral er mangsho bujlo kemne that's kinda sus
Dr. Amit Majumder,গরীবের জেমস্ বন্ড….
JB Biswas,"ভাই বিশ্বাস করবেন কিনা জানিনা আজকে আমি খাইতে গেছিলাম সুলতান ডাইনে, খাবারের সময় চারটা চুল পেয়েছি, পরে উনাদেরকে বলার পর উনারা খাবার চেঞ্জ করে দেয় কিন্তু আমার কাছে ভিডিও সহকারে আছে, এটা আমি অবশ্যই ফেসবুকে আপলোড করব। এদের খাবারের মান খুবই খারাপ, আল্লাহ জানে খাবারের পর আমার কি হবে।"
Aman Mehdi,when did you take the job for
Abdullah Al mamun,Lets form a justice league in bangladesh
TAREQUE MAHMOOD,How much you get from sultan dine.
Minha Rahman,Haaaaa ki khelam etodin️
Android phone Technology,বাইরে কি সত্যিই কুত্তা দিয়ে বিরিয়ানি
Murshed alam,কুক্তার বাচ্চা ফুট ফুটে সুন্দর।
FISHFRY,"BHAI ONADER KE AI MANGSOTA KHETE BOLBEN , TOKHON EE DHORAA PORBE"
shekh sopon,চোরে চুরি করে কি কখনো স্বীকার করে!
Ahammad Al Mamun 19-8347,eta tk dia PR er jonno dakse
Abraham Lincon,আমার দেশের ফুড ব্যবসা টাকে ধ্বংস করার চেষ্টা করছে.... কিন্তুু কেন?? এরা কারা??
jalal,Nice bai
soniya rahmaan,medical test a bojha jete pare bhaiya
uWuBot,Missing Arksine
Eshan Mustak,Rafsan er question gulo marattak
AKTER AYENA,
Muhammad  Farhan Rahman,"আপনি যখন  গোস্তো খাচ্ছিলেন তখন আপনি উনাদের  ও খেতে বলতেন তাহলেই বুঝা যেতো।
আপনি তো আবার টাকা খান নি??"
Rafiq Ullah,Je mangsho ta khai so oi ta amar priyo kukur Tommy are dodge er chilo
Abdullanirob,আপনার শেষ কথা গুলো শুনতে চাই।
Wrestling Beast 3,Bhai stadium a giye Khabar review koren
Zeehan Parvez,1:06
Mahin Rahman 2.0,Review video chilo eita
Jamel Hosen,"Hahahah vai asolei boi lagbe khaite 
Mon chaibena"
F͛A͛R͛I͛H͛A,
Tafsir Hossain Kamal,Vai  khashi ki matton?..
OMOR IBNA HASAN,DNA test korle e to hoy ??????
Mamun Ahmed,একটি ভালো মানের রেষ্টুরেন্ট এরকম করবে আমার বিশ্বাস হচ্ছে না কারন তারা কুটি টাকা ব্যবসা করছে
alin das,lol.
Today TikTok Competition Shorts,If dadal had a face
Galaxy,টাকার যন্য মানুষ গু ও খেতে পারে!!
bubbles,Keno tumi 1 piece mangso nia lab e jete parla na camera nia? Eto voy pele hobe na Rafsan!
rejaur rahman,আসল ঘটনা কি হইছে একমাত্র কর্মচারী আর আল্লাহ ছাড়া কেউ জানে না। এখন এই অবস্থায় বাসায় রান্না করে খাওয়া টাই উচিত বলে মনে হচ্ছে
Ranar Touhid,ভোক্তা অধিকার lite
Abdullah M. Kushan,Lab test aste eto din lage?
Karigar Media,Kacchi vhaier kacchi testy na
Sabrina Sadia,jonokhonto ra taka cheyeche? income tax?
Habib Khan,"What a smart way to clean their name , they just paid rafsan so rafsan can clean their name and by this promotion people will come back again. Wow what a smart way of marketing and win people trust at the same time"
Sahad Ahmed,rafsan re taka dise tau sultans dine e gese niceeeeee bangali asolei takar khasi
SHIKDER MD ROBIN,"Unexpected justice from Rafsan! I was thinking him as an honest food blogger but from today how he manipulated in the last part of this video, it was just a shame. 
We all know deep inside that actually it’s mutton not other animals, Bhai seriously, What’s the point? Why a sultan dine would do that? Mutton is not that expensive compare to their biriyani price right?"
S A Sabbir,Ami taw vlo khai nai
Shifat Al Islam,Halal certificate die den
Rajib Ahamad,ভাই সুলতান কত টাকা দিছে আপনাকে। প্লিজ জানাবেন
KnowledgeWave,আমার কুকুর টা কে ২দিন ধরে খুজে পাচ্ছি না!
poggyi,Yes bro Bangladesh amon i
Evil Herobrine,Hotel in ohio
rain andsnow19,7:48
Neel,Bhai akhon mone hoche ja sultan dines nijeder brand ad ar jonno atto kokor ar tal korse ... nijerai lol
MD. SARWAR HOSSAIN,9:52
Shakib Hasan,U said well bro. Smart corrupted country
KHADIZA RANI,Sobar samney onader boleyn khabar try kortey .dekhanor jonno.
Rahid Islam,Rapsan vai eto kicu nah kore forensic test korle to hoy Jamela sesh Asole Bangladesh mane
Sujon Roy,Vai amar khasi ta harai gese
Hridoy,kutta or khasi doesnt matter as long there is meat
TahmidShadow,Lol
SN Saajid,Amader Bangladesh 🇧🇩
Foods Factory,"মোটামুটি সব ইউটিউবার দের তারা টাকাবমেরেছে, এছারা এই বিপদ থেকে রেহাই পাওয়ার উপায় নেই"
Abdur Rahman,dowa roilo sobar jonno
Md Saifulislam,ফাওখাওনের লাইগা ভাইয়া তুমি তো পাতিলের লগেতুমি তাদের  চাকরির পেটে হাত দিয়া দিছো মিয়া
Risuva66,Adar achorom onk vlo
SYNTAX GAMER FF,10:30
Siam Haque,9:12
Otp Iase,Lol
💰 Instant $740 Daily With Olivia,If you're going through hell keep going. ﹥﹥Winston Churchill
Sakil Ahmed,Showing them memes and trolls doesn't make a sense.
zerin Nushrat,eijinonnoi..tomake...eto..valolage...khati..kotha..bolo..alwz
Utso Op,"ভাই আপনাকে কতো টাকা দিয়েছে
সুলতান ডাইন"
REZ CO,2021 সালে আমরা ছাগল কিনে ছিলাম গরুর বদলে ছাগল টা কিন্তু অনেক বড় ছিল সেখানে এরকম ছোট ছোট হার ছিল ছাগলের মাংস এমনিতে মজা কম গরুর মাংসের তুলনায় তাই বলে কুত্তার মাংস
Mahmud Iqbal,"রাফসান তুমি ভিডিও এর প্রথম ১ মিনিটের মধ্যে যে বললা, ""কুত্তা রাস্তায় নেমে গেছি, সুলতান ডাইন কী করতাছে ""। এ কথাটা কাদের বললা??"
Kenil Hornel,Tara kaj korbe ki dekhaia korbe
saiful sany,Vai sultan dain sotti batper...or manus k kharap khaber khowai..bujlen..
Troxic Hyper,free ta mangsho kheye nilo 6:14
hello music,DRMC er video ta kobe charben ???
Resal Ahmed,Paid vedio rafsan vai
Abdullah Al Hussain,"এইটা একটা বিজনেস পলিছি
যারা সুলতান ডাইন্স চিনতো না তারা ও এখন চিনেছে"
aiyad alif,Bhai apni already boro e achen apni ar ektu boro hoile toh Bura hoiye jaben
Samanta Mehjaabin,Vai lab e test Koran na please
Adib Muntaha Shah,
Samim Ajmain Rafi,Apne ekhon bhalo ekta eye
kazi Jisun,vai ajke amar ak ta dog pacci na .
সোনার বাংলা,আমার একটা কুত্তা আছে
Shahriar Bin,Tui haat dhos nai beta!?
Meena Moujit,হোটেলের বিরিয়ানি খাওয়া বনদ কর
Mamun sikder Sikder,আমার মনে হয় না কুকুরের মাংস কোন হোটেলে খাওয়াবে কিছু কিছু থাকতে পারে
Funny Fun,খাবারও খাইলেন টাকা নিলেন।
Mojammel Vines,7:44 uni j mittha bole bujhai jay
Md babu,Rafsan inbox korba???
Mt Sabbir,"সাংবাদিক কে পকেটে নিবে কেন ?
তোমারে তো ঠিকই টাকা দিয়ে ভিডিও বানাইছে । পাবলিক কি এইটা বুঝে না"
Edite_ Master,Vaiya on are bolten je apni aktu khaiya dekhan
Shakib,3:30
Afnan,No Sultan dine is good bro
zahid hossain,২৫০ কেজি খাসির মাংসের সাথে ৫০ কেজি অন্য প্রানীর মাংস মিশিয়ে রান্না করলে সেটা ধরা অসম্ভব কারন প্রতিদিন কে ল্যাব টেস্ট করাবে?  সব কাচ্চির ব্যাপারেই একই অবস্থা
nahim etc,je jai kok sultan dine ar kacchi moja ace
Mr. Kumar,"Kukurer mangso hoile to vai khaito na goile...
Tai na?"
MD MOZAMMEL,Vai jan apnar camerar nam ki
"Traveling VLOG,FANS",কুকুরের মাংস  রান্না ও হয় ....
AHNAF HOSSAIN,"Manush famous hoile fatrami barray dey 
Rafsan is the perfect example"
fahim khandokar mim,Ami kokhonoi kabo naaa.........ai sultan a
Syed Rezwanur Rahman,"Keysher mangsho Jani na,Tobey are biriyani dokan theykey khabo na.shudu Beyer dawat thakley onno kotha."
F. Md. Tamal,ঘেটো নিগা থাগ লাইফ
Israfel mafuj,"এখন এই ছেলেটা এমনিতেই ফালতু  আবার নিজের গেছে দেখতে, কেন এই সব দেখতে তো পুলিশ বা সরকারি লোক আছে সব কিছু তেই বেশি"
BTS Bangla Dubbing,2:00
Himel Rashid,Tmre tk diya sponsore korle thiki sultan dines ar sunam korta ...tk dile tmio change hoia jaita rafsaan ...eta Bangladesh tk diya sob i hoy
Sujoy game zone,invite vojon bari Patuakhali
JITU EXPLORER,Sultan kacchi️ Joto khacchi aram pacchi.
Md Showkot,Close All the Branch
Showmick lofi & slow,ভাই এই ঝামেলা মিটমাট এর জন্য আফরিদি ভাইরে আনা হোক
Shahinur Islam,bro dna test koren ?
Sayed Wahid Ahmed,Punojonom 4 is sultan dine....
Rofique Ullah,Asholei taka diye shb possible Bangladesh e
Atrackty,bruh apni akhono boro hon nai
Md. Chow.,"Sultan aamaar naam,"
Md. Iftekhar Hossain,AGM সাহেব তো ভাজা মাছটিও উল্টে খেতে জানেন না। তাঁকে এতো কঠিন প্রশ্ন করো কেন?
SAHIL*,4:29
Mahin Rahman 2.0,Vai Tumi ki Manush hobe na ?
monir zaman,"আপনার শেষের কথাগুলো ঠিক আছে? কিন্তু সব থেকে বড় আদালত হচ্ছে নিজের বিবেক। যে যেরকম কর্ম করবে সে সেই রকম ফলই পাবে, আজ অতবা কাল। আর স্বর্গ অথবা নরক অথবা বেহেশত অথবা দোজখ এসব কথা না হয় নাই বলললাম।"
Minhazul Raiyan,AGM er pichoner loktar reaction dekhlei bujha jay
BD Gang,Rafsan er koliza onak boro or sahos ace
Arifur Rahman,Manager r AGM ke chikon haddir gosto khete bola uchit chilo...
Sabbir Ahmed,Marketing শুরু হয়ে গেছে  টাকার কাছে স্পব বেচেঁ দিস তোরা
Jamal Uddin,Last part motovaton
SAHIL*,4:00
Adventure Land Park,background music so high
Araf Sabil,আপনার উচিত ছিল কাচা মাংস সংগ্রহ করে লেবে পরিক্ষা করানো।
Azam Rafi,5:00
144M ANIME - 1.1M views. 7 hours ago,Bhai apni abar mota hoie jaccen
Abdun Noor,নো চেন্জ আফটার ইওর ভিজিট
rubaiyat kahn,Malik jorito noy staffer karshazi vet doctor bone dekley buzbeh 6 kg boleh  shikar kora
Jerry Hazra,Agm beta tar  kotha kemon jani mitha mitha
saiful sany,Sultan dain ar manager k dakle e mone hoi j oi batper..or  kother moddhe e batpare bujlen..
Rahat Sikder,vai. Tangail gatail Dhalapara Monose marse Wednesday
Shafiul Islam,"Khubi lame ekta content chilo eita 
Ekta controversy hoiche oi jaigay giae meme dekhanor bepar ta reasonable na ashole ar thumbnail ow khub cheezy hoiche .
Ami sudhu ei content er bepar ta boltechi so don't take it personally"
Ash Hanz,"CID er daya, avijit er chakri khaya diba naki choto vai 🫡"
Akramul Islam,"রাফসান আসে  নাই। 
আর উনি বলছে সুলতান ডাইনের ফ্যানস কয়েক বার দেখছে। 
তারপর ভিডিও তে দেখছে। 
রাফসান জীবনেও বানাই নাই ভিডিও।"
Zaman Sarkar,১০ হাজার টাকা কি সুলতানস এর কাছে ঘুষ চাইতে পারে? ১০ হাজার কি কেউ ঘুষ চায়?
first touch game,Rafsan tumi to mota howe jaiteco
Rafsan TheChotoBhai|Black Love|Hashina Akther|Mayesha Moni|Rayan Rahman|eloraa|Orchid Chakma|Abid Vlogs|Arafat Rahman|Tahsiinn|badass_bloke|brownie🥧|Queeno|vEnomous|Abrar Faisal Tanzim|abrar karim|Tahiya Azad|Ilham Yaman|Evergreen bd|Estadul Hoque Foyej|Tanzir Hossain|Nightcrawler|Lil AK47|This is Shawon|Alok de do 69|Khaled Nasir zafar|Raihan Rajon|Savage999+|Muktadir Hasan Rajin|Takbir Harun|Pooja|আম মিডিয়া|Fahmida Anzum|Saadman Rahman|Arab On|SYED SHEZAN|Samira akter|Mini Biral|Ishtiak Primon|khushi|Explore With WatLYF|clownX|Mariya|Nazma Chowdhury|maria mahi|Tanvir Osman|Mahika Jannat|lina islam|Hrittika Acharjee|Rubaiyat islam official|Mahidur Rahman|Hrittika Acharjee|Mahidur Rahman|Hrittika Acharjee|Videos|Videos|Videos|Roni Munshi|BaBy_ArMy,"Hey Guys, umm if this helped it would mean a lot if you subscribed to my YouTube Channel ️|Rafsan️️️|Nice rafsan dope production|Bro loved this video it helped a lot:))|Already subbed!️|Hiiiii, ofc, I subbed :')|Smoke weed everyday|Assalamu Alaikum bro. How Are you. Love from Sylhet ️. I am deaf and dumb. Abid Ahmed.|I will try that|Go ahead Brother️|You are an inspiring person. Not just a famous Youtuber. I love your work. You are great.|Ufff finally!! Was waiting for this||im really skinny anyone got any tips for that?|Rafsan|rafsan bhaia tmr pc r specs ki?|Tiktok reacting video cai|গাঁজা খাইলে সব হবে️️|I lose my weight 86 to 72 kg in only 2months. Every morning I used to walk 2kilometers and running 1kilomiters. I followed diet plan like  u. But not similar. Now I am happy like U🇧🇩|মোটা ভাই এখন হিরো|Love you so much|1 Million chai|This comment will get 10k|️️️|o|Rafsan bhai nowadays tomar video eito cringe ken eito content ta bhalo koro and kindly attitude ta off koro|What you show, i eat less then that or little similer 2.5 years still i am not loosing any weight.. I cannot eat any potassium cz of i have kidney issus..|TNX BRO|Vai ami mone kori apni american  yutuber|apnar height koto?|Rafsan u r my Ideal️|Rafsan vai ami tmr sathe ektu kotha bolte chai|️️|I also maintained diet  in my hostel life (2014 to 2018)
  But in last 3 year (after completed my hostel life) i gain so much weight.. 
 It is so hard to maintain diet in home in front of my parents.|Friends mom|love u bro|Rafsan you very far|Vaiya murgir dim 2 ta na haser|Bro don’t lie. You are not active on insta dms|Love u rafsan|love from Kolkata, India.|Choto|You're So Cute|Assalamualaikum Rafsan ...tumi sokale kokhon ghum theke udhta ?||@rafsantheChotobhai make a room tour I love your PC|Mann️|I big fan your|Just for this video I subscribed your channel. Ai video er karone apnar fan hoiya gelam bhaiya|Do u hv strech marks during this rapid change?|Bhai Bangla bolle Valo hoi... English ektu bujte kosto hoi|@Mahidur Rahman  channel dekhte thaken aste aste shikhe jben|@Hrittika Acharjee  shob pari na amn noi jst taratari bolle kosto hoi|@Mahidur Rahman  first mobile nile jmn akta akta koira type kora hoy taratare type kora jay na tmn atao. Content gulo dekhte thaken apnar sub conscious mind e apnake bujhabe je eta ki|Vi banglaiiieeee kotha blo I proud our language and I cannot understand maximum sentence English I need Bangla please bro:)|Good job vi|Life is short so you do to your all passion good luck bro Allah Hafiz|help mee....suggest me bro...|@Estadul Hoque Foyej"
Arafat Hossen|Afrodity Zaman Akli|Sabiha Khan Fuggi|SADIA SULTANA|SADIA SULTANA|SADIA SULTANA|Mini Captures!|Aloy Ahamed sakib jr.|Rafiqul Islam|Some Guy|Samia Akter|Nancy Denvers|𝑴𝒂𝒓𝒛𝒊𝒂 𝒏𝒖𝒓🇧🇩|Fukai,"I also had almost similar journey like yours.
I lost almost 40 kgs.
114 kgs to 75 kgs
When u were talking about insecurities and confidence i was getting emotional bcz I might connect my self to ur words.
Loosing weight is like rediscover ur self.
And thanks a lot Rafsan vaiya for sharing ur story!|Hi|Hey can u help|Bro?|Can you suggest me something?|Apnar fb kih?|Vaiya apni ki apnar plan ta share korte parben j ki ki korechen daily|Bai diet plan ektu bolen|You Did it, brother|Hi, I’m 117kg and 70 kg is my aim. How did you do it and how long did it take?|40 kg losse korte kot9h din lagse b9lben plz|Can you please share some tips????|Etto comment kortese kire vai,,vab maras kn???kaukei ans dilina|@Some Guy  did you lose the weight brother?Any update?"
Rumana Afreen|Saiful Soton|Allea Bagom|Oishee|Sayeda Synthia|Choya Akter|Rumana Afreen|Asif Khan|Shahriar Hossain,"I lost 45 kgs after gave birth to my baby girl. It's been  10 years ago. Still, now my weight is 50 kgs. I was following your diet style. When I watched it, I went back to 10 years ago. Lots of love and dua for you. Stay blessed.|Great|Api tme r ki ki korso|Hoy long did it take?|Apu tumi ki rafsan er diet e krcho?and r ki ki krcho?|Kivabe follow korsen akto bolen plz|@Choya Akter: I didn't intake any carbs for around 6 months. I had been taking low carbs vegetables, fish, chicken, and green apples. And last but not least continued my regular exercise twice a day.|Have you taken anu fat burner supplement?|Bro same i lost 87 kg weight"
mohammed hridoy|MD.Jahangir Alam|unknown pest|MD.Jahangir Alam|TireD AkA FalL|Swapuuu|Daain Muhammad|Ahiyan Azhar|istiaque chowdhury|iii,Used to be 100kg. Now I’m 81. Dude that insecurity and confidence part is as real as it gets|Vaiya ekta kotha chilo apnar sathe|How?|apnar ki chest fat decrease hoise??|@MD.Jahangir Alam  dudu|@MD.Jahangir Alam  ota ashole kokhonoi jayena joto na din na exercise korcho patla thakar somoyeo dudu chilo hai oto beshi bulging chilo na but chilo ekdom stretched wala chest tokhon i hote pare jokhon chest wala execise korbe|Please tell me how|@Swapuuu  bru is there any exercise to reduce this chest fat...realli i am feeling so much shame n insecure with my life n doesnt get any confidence with any activities n its having increase day by day. Actually i cant explain u how much painful it is!!|@Ahiyan Azhar  bro i do gym from when i was 14/15 now i am 25 in this corona time i was overweight now i am loosing weight.but my body is ok feel free to knock me.|Yup I was 103 now 87
Amrita De Aiyer,"'Porer din to tumi khaba. Na kheye to thaakte so na.' This line clinched it for me! The most important thing is this mind control during our entire effort at a balanced diet, portion control, exercise to maintain a healthy weight on a regular basis. Thanks Rafsan!"
Ramisa Islam,You've become a great inspiration for those youngsters who are suffering through body shaming because of their over weight and obesity...Hats off bro...
Ishant Khurana,"I do have the exact same journey as you, like in the start 12th standard I was about a 120 kgs and in 4 months I lost around 38 kgs and be on that 82 kg mark. And I did this transformation because of the fat shaming n all that every fat person faces. I do completely agree with that it helps in every aspect of your life from studies to social skills, can say that because of transformation only I was able to focus more on studies got a very nice percentage in 12th boards."
Rudrajit Roy|suprova bhuiyan medha bhuiyan|Abuzafor Mohammed Aman|Rudrajit Roy|Rudrajit Roy|hihihihihiji|Rudrajit Roy|Abuzafor Mohammed Aman|Rudrajit Roy|hihihihihiji|Abuzafor Mohammed Aman,"Loosing weight actually brings back our confidence
It happened with me 
I was 100 kgs 
Now I'm 54 
Trust me diet and workout works wonders|basically which type of diets you followed ? and kotodin legeeche >?|Apna akto bashi komiya falsen|@Abuzafor Mohammed Aman  hae bhai 66 target chilo akta time pore weight loss control kora tough hoye jae|@suprova bhuiyan medha bhuiyan  amar 5 months er mata lagse ( hard diet chilo) er age 2 maash gym krsilm 
But basically lockdown er time e gram er baritae weight ta komaisi
Shakal e running then 2 times exercises ( abs and free hand / including squats, planks ) r diet e carbs baad diye disilm like ruti / bhaat chere disilm for 5 months|almost lose 50 kg|@hihihihihiji  34 kg komanor target chilo apu 
But control korte pari nai
Last 2 maash dhore weight ta iktu baranor try krtesi but komanor theke barano onk beshi tough|@Rudrajit Roy  Apnar height koto|@Abuzafor Mohammed Aman  5'9|@Rudrajit Roy  but akon weight bharate kno chao|@Rudrajit Roy  Weights atlist 70 to 75 rakhta hoba apnar"
Tuan Tran - Fitness Coach,Hello bro :) I love how inspiring you are on your weight loss journey! It's motivating to follow others who are on this journey. A lot of people quit but not you. New subscriber to support you ️
Aifa Khaira,"I was 80kgs at the beginning of this year, I am 64kgs now still on process of losing, it's so true how being fit can gain us confidence and make us get rid of our lots of insecurities"
Muntasir Moon,"thank you rafsan, you're my inspiration  currently my weight is 85 kg I'll get 65 kg in 120 day (4 month) in sha Allah. let's see!  I'll update my progress regularly here.
️Day 01 :
 Alhamdulillah Done Intermittent Fasting with 30 min exercise.
Day 02:
 Alhamdulillah Done Intermittent Fasting(Diet) with 20 min exercise (can't do further, I'll make it 30 after two weeks in sha Allah).
️Day 03:
 Alhamdulillah Done IF with 20 min workout. (today i got demotivated one of my friend told me "" কীরে তোর ভূড়ি কমেনা এক্সারসাইজ করছিস উলটা দেখছি বাড়ছে""
 i hate my body . I'll do hard)
Day 04:
 Alhamdulillah Done IF with 20 min workout.
️Day 05:
Day 07:(1 days slipped) 
️Day 08: again I'm depressed আরেকজন বললো ভূড়ি কমেনা ক্যান ব্যায়াম করতেসোস তো, খাওয়াদাওয়া ই বন্ধ করে দিবো নাকি :)
Day 09:
Day 10: rest day
Day 11:
Day 12:
Day 13:
Day 14:
Day 15: had exam
Day 16:
Day 17:
Day 18:
Day 19:
Day 20:
Day 21:
Day 22:
Day 23:
Day 24:
Day 25:
update : now 77 kg,  lost 8 kg.  12 kg to go
update : 74 kg. 9 kg to go. will start at march 1, in sha Allah."
Mukta Purkayastha|Ahanaf hasan|M.H. Ahnaf|Ahanaf hasan|Tusher Hossen|Namir Reza|M.H. Ahnaf|Ahanaf hasan,"Body shaming is literally the best thing you can do to break someone's confidence, self love , vibes,heart . In a word it's the best way to break someone's soul and make people feel terrible about their own self|I am fat but i think body shaming isn't bad|@Ahanaf hasan  well I think|@M.H. Ahnaf  your bad|@Ahanaf hasan  yes cause it influences you to loose weight|@M.H. Ahnaf ?|@Ahanaf hasan  thats why i said fix your grammar you don’t even now the meaning of pathetic and pathetic means করুণ|@Tusher Hossen  yeah that's the point"
