User,Comment
rubaiyat kahn,Malik jorito noy staffer karshazi vet doctor bone dekley buzbeh 6 kg boleh  shikar kora
Jerry Hazra,Agm beta tar  kotha kemon jani mitha mitha
saiful sany,Sultan dain ar manager k dakle e mone hoi j oi batper..or  kother moddhe e batpare bujlen..
Rahat Sikder,vai. Tangail gatail Dhalapara Monose marse Wednesday
Shafiul Islam,"Khubi lame ekta content chilo eita 
Ekta controversy hoiche oi jaigay giae meme dekhanor bepar ta reasonable na ashole ar thumbnail ow khub cheezy hoiche .
Ami sudhu ei content er bepar ta boltechi so don't take it personally"
Ash Hanz,"CID er daya, avijit er chakri khaya diba naki choto vai 🫡"
Akramul Islam,"রাফসান আসে  নাই। 
আর উনি বলছে সুলতান ডাইনের ফ্যানস কয়েক বার দেখছে। 
তারপর ভিডিও তে দেখছে। 
রাফসান জীবনেও বানাই নাই ভিডিও।"
Zaman Sarkar,১০ হাজার টাকা কি সুলতানস এর কাছে ঘুষ চাইতে পারে? ১০ হাজার কি কেউ ঘুষ চায়?
first touch game,Rafsan tumi to mota howe jaiteco
Rafsan TheChotoBhai|Black Love|Hashina Akther|Mayesha Moni|Rayan Rahman|eloraa|Orchid Chakma|Abid Vlogs|Arafat Rahman|Tahsiinn|badass_bloke|brownie🥧|Queeno|vEnomous|Abrar Faisal Tanzim|abrar karim|Tahiya Azad|Ilham Yaman|Evergreen bd|Estadul Hoque Foyej|Tanzir Hossain|Nightcrawler|Lil AK47|This is Shawon|Alok de do 69|Khaled Nasir zafar|Raihan Rajon|Savage999+|Muktadir Hasan Rajin|Takbir Harun|Pooja|আম মিডিয়া|Fahmida Anzum|Saadman Rahman|Arab On|SYED SHEZAN|Samira akter|Mini Biral|Ishtiak Primon|khushi|Explore With WatLYF|clownX|Mariya|Nazma Chowdhury|maria mahi|Tanvir Osman|Mahika Jannat|lina islam|Hrittika Acharjee|Rubaiyat islam official|Mahidur Rahman|Hrittika Acharjee|Mahidur Rahman|Hrittika Acharjee|Videos|Videos|Videos|Roni Munshi|BaBy_ArMy,"Hey Guys, umm if this helped it would mean a lot if you subscribed to my YouTube Channel ️|Rafsan️️️|Nice rafsan dope production|Bro loved this video it helped a lot:))|Already subbed!️|Hiiiii, ofc, I subbed :')|Smoke weed everyday|Assalamu Alaikum bro. How Are you. Love from Sylhet ️. I am deaf and dumb. Abid Ahmed.|I will try that|Go ahead Brother️|You are an inspiring person. Not just a famous Youtuber. I love your work. You are great.|Ufff finally!! Was waiting for this||im really skinny anyone got any tips for that?|Rafsan|rafsan bhaia tmr pc r specs ki?|Tiktok reacting video cai|গাঁজা খাইলে সব হবে️️|I lose my weight 86 to 72 kg in only 2months. Every morning I used to walk 2kilometers and running 1kilomiters. I followed diet plan like  u. But not similar. Now I am happy like U🇧🇩|মোটা ভাই এখন হিরো|Love you so much|1 Million chai|This comment will get 10k|️️️|o|Rafsan bhai nowadays tomar video eito cringe ken eito content ta bhalo koro and kindly attitude ta off koro|What you show, i eat less then that or little similer 2.5 years still i am not loosing any weight.. I cannot eat any potassium cz of i have kidney issus..|TNX BRO|Vai ami mone kori apni american  yutuber|apnar height koto?|Rafsan u r my Ideal️|Rafsan vai ami tmr sathe ektu kotha bolte chai|️️|I also maintained diet  in my hostel life (2014 to 2018)
  But in last 3 year (after completed my hostel life) i gain so much weight.. 
 It is so hard to maintain diet in home in front of my parents.|Friends mom|love u bro|Rafsan you very far|Vaiya murgir dim 2 ta na haser|Bro don’t lie. You are not active on insta dms|Love u rafsan|love from Kolkata, India.|Choto|You're So Cute|Assalamualaikum Rafsan ...tumi sokale kokhon ghum theke udhta ?||@rafsantheChotobhai make a room tour I love your PC|Mann️|I big fan your|Just for this video I subscribed your channel. Ai video er karone apnar fan hoiya gelam bhaiya|Do u hv strech marks during this rapid change?|Bhai Bangla bolle Valo hoi... English ektu bujte kosto hoi|@Mahidur Rahman  channel dekhte thaken aste aste shikhe jben|@Hrittika Acharjee  shob pari na amn noi jst taratari bolle kosto hoi|@Mahidur Rahman  first mobile nile jmn akta akta koira type kora hoy taratare type kora jay na tmn atao. Content gulo dekhte thaken apnar sub conscious mind e apnake bujhabe je eta ki|Vi banglaiiieeee kotha blo I proud our language and I cannot understand maximum sentence English I need Bangla please bro:)|Good job vi|Life is short so you do to your all passion good luck bro Allah Hafiz|help mee....suggest me bro...|@Estadul Hoque Foyej"
Arafat Hossen|Afrodity Zaman Akli|Sabiha Khan Fuggi|SADIA SULTANA|SADIA SULTANA|SADIA SULTANA|Mini Captures!|Aloy Ahamed sakib jr.|Rafiqul Islam|Some Guy|Samia Akter|Nancy Denvers|𝑴𝒂𝒓𝒛𝒊𝒂 𝒏𝒖𝒓🇧🇩|Fukai,"I also had almost similar journey like yours.
I lost almost 40 kgs.
114 kgs to 75 kgs
When u were talking about insecurities and confidence i was getting emotional bcz I might connect my self to ur words.
Loosing weight is like rediscover ur self.
And thanks a lot Rafsan vaiya for sharing ur story!|Hi|Hey can u help|Bro?|Can you suggest me something?|Apnar fb kih?|Vaiya apni ki apnar plan ta share korte parben j ki ki korechen daily|Bai diet plan ektu bolen|You Did it, brother|Hi, I’m 117kg and 70 kg is my aim. How did you do it and how long did it take?|40 kg losse korte kot9h din lagse b9lben plz|Can you please share some tips????|Etto comment kortese kire vai,,vab maras kn???kaukei ans dilina|@Some Guy  did you lose the weight brother?Any update?"
Rumana Afreen|Saiful Soton|Allea Bagom|Oishee|Sayeda Synthia|Choya Akter|Rumana Afreen|Asif Khan|Shahriar Hossain,"I lost 45 kgs after gave birth to my baby girl. It's been  10 years ago. Still, now my weight is 50 kgs. I was following your diet style. When I watched it, I went back to 10 years ago. Lots of love and dua for you. Stay blessed.|Great|Api tme r ki ki korso|Hoy long did it take?|Apu tumi ki rafsan er diet e krcho?and r ki ki krcho?|Kivabe follow korsen akto bolen plz|@Choya Akter: I didn't intake any carbs for around 6 months. I had been taking low carbs vegetables, fish, chicken, and green apples. And last but not least continued my regular exercise twice a day.|Have you taken anu fat burner supplement?|Bro same i lost 87 kg weight"
mohammed hridoy|MD.Jahangir Alam|unknown pest|MD.Jahangir Alam|TireD AkA FalL|Swapuuu|Daain Muhammad|Ahiyan Azhar|istiaque chowdhury|iii,Used to be 100kg. Now I’m 81. Dude that insecurity and confidence part is as real as it gets|Vaiya ekta kotha chilo apnar sathe|How?|apnar ki chest fat decrease hoise??|@MD.Jahangir Alam  dudu|@MD.Jahangir Alam  ota ashole kokhonoi jayena joto na din na exercise korcho patla thakar somoyeo dudu chilo hai oto beshi bulging chilo na but chilo ekdom stretched wala chest tokhon i hote pare jokhon chest wala execise korbe|Please tell me how|@Swapuuu  bru is there any exercise to reduce this chest fat...realli i am feeling so much shame n insecure with my life n doesnt get any confidence with any activities n its having increase day by day. Actually i cant explain u how much painful it is!!|@Ahiyan Azhar  bro i do gym from when i was 14/15 now i am 25 in this corona time i was overweight now i am loosing weight.but my body is ok feel free to knock me.|Yup I was 103 now 87
Amrita De Aiyer,"'Porer din to tumi khaba. Na kheye to thaakte so na.' This line clinched it for me! The most important thing is this mind control during our entire effort at a balanced diet, portion control, exercise to maintain a healthy weight on a regular basis. Thanks Rafsan!"
Ramisa Islam,You've become a great inspiration for those youngsters who are suffering through body shaming because of their over weight and obesity...Hats off bro...
Ishant Khurana,"I do have the exact same journey as you, like in the start 12th standard I was about a 120 kgs and in 4 months I lost around 38 kgs and be on that 82 kg mark. And I did this transformation because of the fat shaming n all that every fat person faces. I do completely agree with that it helps in every aspect of your life from studies to social skills, can say that because of transformation only I was able to focus more on studies got a very nice percentage in 12th boards."
Rudrajit Roy|suprova bhuiyan medha bhuiyan|Abuzafor Mohammed Aman|Rudrajit Roy|Rudrajit Roy|hihihihihiji|Rudrajit Roy|Abuzafor Mohammed Aman|Rudrajit Roy|hihihihihiji|Abuzafor Mohammed Aman,"Loosing weight actually brings back our confidence
It happened with me 
I was 100 kgs 
Now I'm 54 
Trust me diet and workout works wonders|basically which type of diets you followed ? and kotodin legeeche >?|Apna akto bashi komiya falsen|@Abuzafor Mohammed Aman  hae bhai 66 target chilo akta time pore weight loss control kora tough hoye jae|@suprova bhuiyan medha bhuiyan  amar 5 months er mata lagse ( hard diet chilo) er age 2 maash gym krsilm 
But basically lockdown er time e gram er baritae weight ta komaisi
Shakal e running then 2 times exercises ( abs and free hand / including squats, planks ) r diet e carbs baad diye disilm like ruti / bhaat chere disilm for 5 months|almost lose 50 kg|@hihihihihiji  34 kg komanor target chilo apu 
But control korte pari nai
Last 2 maash dhore weight ta iktu baranor try krtesi but komanor theke barano onk beshi tough|@Rudrajit Roy  Apnar height koto|@Abuzafor Mohammed Aman  5'9|@Rudrajit Roy  but akon weight bharate kno chao|@Rudrajit Roy  Weights atlist 70 to 75 rakhta hoba apnar"
Tuan Tran - Fitness Coach,Hello bro :) I love how inspiring you are on your weight loss journey! It's motivating to follow others who are on this journey. A lot of people quit but not you. New subscriber to support you ️
Aifa Khaira,"I was 80kgs at the beginning of this year, I am 64kgs now still on process of losing, it's so true how being fit can gain us confidence and make us get rid of our lots of insecurities"
Muntasir Moon,"thank you rafsan, you're my inspiration  currently my weight is 85 kg I'll get 65 kg in 120 day (4 month) in sha Allah. let's see!  I'll update my progress regularly here.
️Day 01 :
 Alhamdulillah Done Intermittent Fasting with 30 min exercise.
Day 02:
 Alhamdulillah Done Intermittent Fasting(Diet) with 20 min exercise (can't do further, I'll make it 30 after two weeks in sha Allah).
️Day 03:
 Alhamdulillah Done IF with 20 min workout. (today i got demotivated one of my friend told me "" কীরে তোর ভূড়ি কমেনা এক্সারসাইজ করছিস উলটা দেখছি বাড়ছে""
 i hate my body . I'll do hard)
Day 04:
 Alhamdulillah Done IF with 20 min workout.
️Day 05:
Day 07:(1 days slipped) 
️Day 08: again I'm depressed আরেকজন বললো ভূড়ি কমেনা ক্যান ব্যায়াম করতেসোস তো, খাওয়াদাওয়া ই বন্ধ করে দিবো নাকি :)
Day 09:
Day 10: rest day
Day 11:
Day 12:
Day 13:
Day 14:
Day 15: had exam
Day 16:
Day 17:
Day 18:
Day 19:
Day 20:
Day 21:
Day 22:
Day 23:
Day 24:
Day 25:
update : now 77 kg,  lost 8 kg.  12 kg to go
update : 74 kg. 9 kg to go. will start at march 1, in sha Allah."
Mukta Purkayastha|Ahanaf hasan|M.H. Ahnaf|Ahanaf hasan|Tusher Hossen|Namir Reza|M.H. Ahnaf|Ahanaf hasan,"Body shaming is literally the best thing you can do to break someone's confidence, self love , vibes,heart . In a word it's the best way to break someone's soul and make people feel terrible about their own self|I am fat but i think body shaming isn't bad|@Ahanaf hasan  well I think|@M.H. Ahnaf  your bad|@Ahanaf hasan  yes cause it influences you to loose weight|@M.H. Ahnaf ?|@Ahanaf hasan  thats why i said fix your grammar you don’t even now the meaning of pathetic and pathetic means করুণ|@Tusher Hossen  yeah that's the point"
Sneha Dey,"You are literally an inspiration bruh!!
My life is now totally like you when you were fat.
Today  I am inspired by you and I hope that one day someone will be inspired by me!"
Ayesha Hasib,Last year you posted a weight loss video and that was my inspiration. I literally loss over 15 kgs in 3 months. And this make a huge change in my life. Thank you so much for your tips.
Simon Edward,"An inspiring transformation, Rafsan. Well done dude!. ️🇬🇧"
Rakib|Arefin Ferdous|Aloy Ahamed sakib jr.|Dip Sakhare,"Hey guys
Alhamdulillah i lost
105kgs to 76️
Thank rafsan for motivating me️|followed the same diet or did exercises too?|Diet ta share korte parba|@Aloy Ahamed sakib jr.  Plz share"
MythBoyPro|Yalina|MythBoyPro|shellina akter|Yalina|MythBoyPro|Abyan Chowdhury|shellina akter|Abyan Chowdhury|MythBoyPro|anas mahamud,"I really lost 21 Kg weight in 6 months after watching your video.
Before I was 96kg and now I'm 75kg.
Much love Rafsan brother ️|he just posted this video 9mints ago bruh._.|@Yalina  I lost weight after watching his first video of weight lost.|@Yalina  nohh he posted a video earlier like years ago about how he lost weight like what motivated him|@MythBoyPro  ohh sorry my bad|@Yalina  It's ok.|It’s a myth bro|@Abyan Chowdhury  huh?|@shellina akter   the name of the person who commented|@Abyan Chowdhury  Why?|মেইনটেইন কিভাবে করবো ভাইয়া"
Chameli Khan,"This is exactly the thing i m tired of making people understand why looking good is important for someone.
Thanks broyour words hit like a magic"
Meharun Nissa,"by following his 1st diet video i have lost 25 kg in 7 months.. this is really effective guys..just Don't give up as he said....after losing weight i feel more confident about my Self.. all my insecurities just gone.. just do it for your self and never give up
btw I'm 18"
InoTech Sylhet,"Hats off Rafsan, You could have promote fake diets but you didn't, Always to true to the audience, Thanks so much for inspiring so many people out there. RESPECT"
sai :),"my weight also peaked at 118kg during lockdown, and i'm planning to lose it as fast as i can as now i'm 111kg, before this i had lost weight down to 105kg but i stopped trying due to mental health, but now i'm planning to start again so i hope this video helps!! :)
edit: a few days in and i have more energy than i used to, so i've been able to work out a lot easier without losing energy so easily. i'm still yet to check my weight but i definitely feel like this diet is making a huge difference, thank you so much!"
Sami Ullah,"The insecurity and low confidence part is real... I'm in 11th standard and 17 years old. Right now I weigh about 125kg. I have not been going to college for like a month. I am not enjoying my college life, never been in my 11th class a single time... 
Date: 3 November
Time: 1:40 am 
I have promised myself, I'll lose weight and I'll enjoy my life in every term."
tanvir hasan shanto,I lost around 14 kg after seeing ur past video about diet conscious video... Im really grateful to you... You deserve love and respect. Take love from the deepest side of my heart. Thanks vai ️ go ahead and make millions ️️
Md.Ashraful karim,"i was 105,then within 6 monthes i came to 74,with balanced diet and exercise, yes that insecurity part is real,i am more confident then ever,though i gain some wt after covid,i will follow ur advice from tomorrow onwards,thanks a bunch"
Tanha Iqbal,"i can totally relate u when u said how u felt like u've conquered something after losing weight. it feels truly amazing when u do something for urself ,to boost up self confidence and all. i've lost 12kgs in the past 1 yr from 70kgs to 58kgs, still going on . like i would never get bullied by my frnds or i wasn't insecure that much . bt it's like my fam mmbr especially one of my aunts would never just shut up about me being overweight since i was in 5th grade. and the more they talk the more stubborn i would become to not do anything about my weight. i didn't want to change me for them i wanted to do it just for myself. so as i grew up i realized i should shut them first, i spoke out that i don't like them gossipping about my freaking body,cz there's a difference when someone says something out of concern vs when it becomes hot gossip . Eventually, they got tired and i just did what i always wanted to do, just for MYSELF ,not to get validation from anyone. I just wanna say, ya'll don't ever look down on urself, always stay strong on ur ground , face youself, speak yourself and LOVE YOURSELF and make changes only for you."
Rhea Nazmin,"The first video that you uploaded during quarentine last year, that helped me to start my weightloss journey and I lost sooo much of weight with the help of your first video. Thank you rafsan for always inspiring.. ️️️"
Ashura Binte Halim,"Your hardwork showed it's result. Well done , after several bullying incidents you managed to get back your confidence."
Sadman Abir Hossain,I have lost 10 kg in 1 month. this video motivated me. thanks bro️️️
Arifa Bondhon,It takes a lot to admit that you did something wrong ️but you accepted it and said sorry also️ that's admirable
Ashita Savlin,"Thank you Rafsan, for inspiring us"
Salehin Rahat,"Last lockdown I watched your diet video, got inspired and lost 10 kg ️
Now again I've gained 3 kg 
Time to get inspired again 
Cheers rafsan"
duke chowdhury,Rafsan you went through alot. You deserve every single thing you have now. We all you love you so much keep going. And you're the dream of dhaka city ️️
This in Zn Mow🤟,"I lost 9kg within 1 and half month... And now I'm feeling more better and more beautiful 
Loosing weight is a blessing"
𝑹𝑱 𝒕𝒉𝒆 𝑪𝒐𝒏𝒇𝒊𝒅𝒆𝒏𝒕 𝑪𝒂𝒓𝒓𝒐𝒕,Thank you so much for motivating ️
Pilu,Always keep this uniqueness in your videos...the simplicity is what makes you different from any other youtubers...love you brother.
Borushiki_Uzamaki,That's the motivation I needed
Md. Oishik|Nusrat|Sabiha Khan Fuggi|HR mirza yt,"Bro. I can fell ya!
I also losed weight at cass 10.  I was like 82 Kg and I turned this into 57 Kg. And the feeling is on next level.|Kibabe lose korsen plz bolenn|Heyy congrats how did you do that|I also was 82 kg but now i am 70 kg"
joe broadbeef,"Power to You man, not everyone has the internal strength to make these changes and live their Best Life!!!!"
SILVY JAHAN,Thanks bro . You are such a motivation !!!! I was doing diet but kinda taking lot of junks currently but thanks to this video. I'll try to make it better n healthier. Thank you so much for motivating me for this weight loss journey. You the best. R don't worry you will sure get a girlfriend. N maybe you don't acknowledge it but tons of girls have a crush on you. You the best !!!
Gungun arora,Bro you have my heart !!! ️ thankyou this motivation was must needed .
Shorov Paul,Thank you brother for share your story with us.️
purple world,U r sooooooo inspiring man !!!  love u bro
Rokeya Khatun,"peoples who had been suffering from too much weight : 
Rafsan : Inspiration"
Tanvir Hossain Jony,"Thanks Rafsan. You're not just a YouTuber, You're a Philosopher.  Thank you."
Inara Zahin,"Hey, it would be great if you also posted about a diet that you consume during Ramadan. What do you follow to lose/maintain your weight during Ramadan? Anyways, the video is very inspiring. Thanks."
Soham Rick,"What an amazing change in your body, bro...you rock"
sk obaid,That was really hard!! Thanks a lot for sharing your routine
hotchocolate*.✧☆,"Thanks bro for the motivation,i genuinely cried,love you bro<3"
Picchi Vlogger,Youre so hardworking. Love your transformation video.
7SEA • Dominater,"Being Unstoppable begins now️
Thank u for the Motivation️️"
taherajenz,"Well done Rafsan, you done well mate and just showed these bullies of the past and present the middle finger. Keep going my brother, keep inspiring Bengalis and non-Bengalis all over the world my brother. The British Bangladeshi community supports you 🇧🇩🇬🇧"
Duur Duranto,Salute man. Very inspirational
Dipta Shelby,"Workout stuffs like cardios are motivation to me...everyday i do the cardio i just feel motivated that i am sweating throrough success...Everytime the sweating motivates me with the saying that ""Dude you are really not sweating , you are just sparkling""
- Thanks a lot for the motivation bro ... it alreday boosted me like 10x"
Rukmini Das,"It is actually a lifestyle, i do agree, I lost 15 kgs last yr it was very difficult emotionally, but I am maintaining it now very easily. This gives immense amount of confidence. I totally agree with you 
I was fat shamed before now that I have lost weight I am again body shamed by relatives and people whom I know. But I don't let it affect me now, coz deep down I know that I am happy with the way my body looks right now"
jennyy|Nafiz|md.hosain patowary|jennyy|Humugumu|Free Palestine|Lam|Lam,"People should know that body shaming is not FUNNY .Body shaming is really common in our country and it's sad that people find it funny. I've been body shamed since my childhood even now people comment about my body .I just don't care anymore but it hurts yk :)
I'm really proud of you and Thanks that we have someone to talk about these kinda topic .Lots of love from the bottom of my heart <3|Really it hurts.....|Bruh everything has a silver lining. Use it as a fuel to drive your motivation to lose weight. Don't just cry abt it. And sry m8 body positivity shouldn't be applied to morbidly obese ppl. Its unhealthy. :) deal with it|@md.hosain patowary  ik it's unhealthy but making fun of someone becuz of the way  he/she looks is not OKAY and it's Disgusting that some people even assume that they are motivating by doing so .Big lol. I've been trying to change myself( my goal is opposite of his tho) People used to pass harsh words and it would break down my motivation :)|I liked your paragraph dude|Yeah ikr I've also been body shamed a lot by my cousins and other people and my cousins make fun of other fat people like fat isn't even an insult I can't even say anything to them or defend myself because you know how people are you're supposed to be quite and when you be quite your constantly told why you're so quite all the time honestly these kinds of people don't even have brains|Same....I don't care.... sometimes people stare at me like I am an alien|@md.hosain patowary  it's not motivation it's just insult...."
Zinia Azmi,I am so proud of you! Keep up the good work.
INTERESTING REPUBLIK,Hats off! What a motivational video!!
Hamida,This video is just perfect for motivation
Nightcrawler,This is going to open up many eyes.Great work brother.Take love from one of your fans️
prapthi shetty,Thank you for the motivation! Thank you so much.
Zahran Ahmed,"The video I’ve been feverishly waiting for.
Also, Rafsan the G.O.A.T., you accidentally typed “How did I lose so weight?”, as opposed to “so MUCH weight?”
Just thought you might want to know, is all. Absolutely BEYOND phenomenal work, though, brother. You truly are taking over and it is just so clear to see."
Kdrama Unnie,You're such a inspirational person
MD SABBIR HOSSAIN,Thanks for sharing your experience!! ️
Md Atiar Rahman,Inspirational video ️️️ Yeah this one inspired me too... ️
Mushfiqur Rahman Alif,"I lost 24kg in 5 months, not from this video but what he is saying is absolutely true. But you guys have to follow the small bite rule, i promise you thats the key."
MD. Foysal Ul Alam.,From 102 Right now i am 83-84. I feel it bro.
RT Sourav,"I've never been a big fan of Rafsan. But, this video is absolutely stunning. Keep going man"
Umme Hony,Truly inspiring ️
Abu Bakar Bin Abedin,What a transformation!
Munaza Mir,I have same diet as you but I replaced chicken and roti with oats and guys it really works I lost 15 kgs in just 1 month I used to do workout for 2 hours and treadmill too but guys don't go too hard on yourself just believe in yourself and do it  all the best
MD Emon,"I used to weight almost 120kg Alhamdulillah now I'm less thn 70kg. I know how it’s feels when you've been bullying by someone.  Basically in my childhood 70-80% peoples used to bully me bcz of my fatness. Alhamdulillah I'm happy and thankful to Allah that i lost my weight, After this huge transformation. I become more active and confidence person then before."
Farisa Khan,You are no less than a motivational speaker.
Noaisir Haider,Never thought a video has this much power to change my unhealthy  constant and unbreakable lifestyle. Love u bro
Medina Ali,"This is a very good diet because it is not extreme and very doable for the long run. Portion control is definitely the best strategy, and as this diet is comprised of our regular Bangladeshi household menu, its great!"
Sawban Saqib,Every part of your speech was absolutely true...Cuz I faced all those situations and I am a living example...I agree to your diet plan and I also followed the same way you did...BOL.
Sneha Anika,There are many weight loss instructors in YouTube but your advices made my life
Zara Chowdhury,I understand that very well. Very proud of ur transformation ️
AKS.VAI- YT,"I used to 106 kg. 
But in one month my wight is 95 
Thank you for the inspiration"
Arke's Hub,"""In order to achieve something you never had, you need to do something you have never done""
- Chotobhai (2021)
Bro, kothagula buke lagse"
Nishat Tarannum,Thanks Rafsan your video is really very inspiring ️
Torsa,Thx alot for the motivation to those who wants to lose weight Rafsan
Chxrry,"This is the only video that really motivates me to lose weight!  Also, this video got me subscribed to your channel."
